0;1;2;3;4;5;6;7
ID;Компания;ИНН клиента;Контактное лицо;Телефон;E-mail;Адрес;Потенциал
0;Рога и Копыта, ООО;12345678;Василий Пупкин;11 111 111 111;vasya@pupkin.ru;Новые Васюки, ул. Большая, 1;M
1;Троглодит ЛТД;123555678;Иван Иванов;11 111 111 155;ivan@ivanov.info;Новые Васюки, ул. Центральная, 2;S
2;Кисти и глазеты INC;1267878;Петр Петров;11 111 111 125;Petr@Petrov.biz;Новые Васюки, ул. Тупиковая, 15;M
3;Несите Ваши деньги;12234678;Алиса Рыжова;11 111 111 192;Foxy@money.me;Новые Васюки, ул. Верный путь, 77;L
